{ "schemaVersion": 1, "id": "bpmn-pools-lanes-selfparity", "library": "bpmn", "fixtures": ["bpmn/pools-lanes.f1.json"], "ops": "bpmn/edit-undo.ops.json", "exercises": ["RE.renderer.bpmn-participant", "RE.renderer.bpmn-lane", "RE.renderer.bpmn-messageflow"], "comparators": ["model", "events", "geometry", "pixels"] }
