{"schemaVersion":1,"id":"bpmn-task-selfparity","library":"bpmn","fixtures":["bpmn/task.f1.json"],"ops":"bpmn/task-edit.ops.json","exercises":["RE.renderer.bpmn-usertask","RE.renderer.bpmn-startevent","RE.renderer.bpmn-endevent","RE.renderer.bpmn-sequenceflow","RE.command.connection-create"],"comparators":["model","events","geometry","pixels"]}
