{ "schemaVersion": 1, "id": "bpmn-subprocess-expanded-selfparity", "library": "bpmn", "fixtures": ["bpmn/subprocess-expanded.f1.json"], "ops": "bpmn/edit-undo.ops.json", "exercises": ["RE.renderer.bpmn-subprocess", "RE.renderer.bpmn-task"], "comparators": ["model", "events", "geometry", "pixels"] }
